<?xml version="1.0" encoding="UTF-8" standalone="no"?>
<?xml-stylesheet type="text/css" href="style.css"?>
<!DOCTYPE student-log SYSTEM "student.dtd">

<!-- I utilized the attr function in the DTD with the "id" attribute for each student, along with the enrollment and year status (because its an enum). But, other than that, I decided to simply fill in the content for each, much like the music-library example I referenced from the repo-->
<student-log>
  <student id = "1234567">
    <first-name>Gordon</first-name>
    <middle-name>Matthew</middle-name>
    <last-name>Sumner</last-name>
    <preferred-name>Sting</preferred-name>
    <contact-info>
      <email>sting@thepolice.com</email>
      <phone>212.123.4567</phone>
    </contact-info>
    <status enrollment="full-time" year="first-year"></status>
    <academic-info>
      <gpa>4.0</gpa>
      <major>Music</major>
      <minor>English</minor>
      <advisor>Andy Summers</advisor>
      <date-initial-enrollment>08-25-1969</date-initial-enrollment>
      <graduation-date>05-01-1973</graduation-date>
    </academic-info>
  </student>

  <student id = "4567890">
    <first-name>Kim</first-name>
    <middle-name></middle-name>
    <last-name>Thayil</last-name>
    <preferred-name></preferred-name>
    <contact-info>
      <email>kim@soundgarden.com</email>
      <phone>206.123.4567</phone>
    </contact-info>
    <status enrollment="full-time" year="second-year"></status>
    <academic-info>
      <gpa>3.0</gpa>
      <major>Philosophy</major>
      <minor>Music</minor>
      <advisor>Chris Cornell</advisor>
      <date-initial-enrollment>08-25-1978</date-initial-enrollment>
      <graduation-date>05-01-1982</graduation-date>
    </academic-info>
  </student>

  <student id = "8302438">
    <first-name>Saul</first-name>
    <middle-name></middle-name>
    <last-name>Hudson</last-name>
    <preferred-name>Slash</preferred-name>
    <contact-info>
      <email>slash@gnr.com</email>
      <phone>213.456.8392</phone>
    </contact-info>
    <status enrollment="part-time" year="fourth-year"></status>
    <academic-info>
      <gpa>2.0</gpa>
      <major>Music</major>
      <minor>Criminal Justice</minor>
      <advisor>Axl Rose</advisor>
      <date-initial-enrollment>08-25-1983</date-initial-enrollment>
      <graduation-date>05-01-1987</graduation-date>
    </academic-info>
  </student>

  <student id = "2983928">
    <first-name>Emily</first-name>
    <middle-name></middle-name>
    <last-name>Kokal</last-name>
    <preferred-name></preferred-name>
    <contact-info>
      <email>emily@warpaint.com</email>
      <phone>213.123.7654</phone>
    </contact-info>
    <status enrollment="full-time" year="third-year"></status>
    <academic-info>
      <gpa>3.8</gpa>
      <major>Political Science</major>
      <minor>Law</minor>
      <advisor>Jenny Lee Lindberg</advisor>
      <date-initial-enrollment>08-25-1998</date-initial-enrollment>
      <graduation-date>05-01-2002</graduation-date>
    </academic-info>
  </student>

  <student id = "7645726">
    <first-name>Mike</first-name>
    <middle-name></middle-name>
    <last-name>Inez</last-name>
    <preferred-name></preferred-name>
    <contact-info>
      <email>mike@aic.com</email>
      <phone>213.444.3323</phone>
    </contact-info>
    <status enrollment="full-time" year="second-year"></status>
    <academic-info>
      <gpa>4.0</gpa>
      <major>Business Management</major>
      <minor>Math</minor>
      <advisor>Jerry Cantrell</advisor>
      <date-initial-enrollment>08-25-1984</date-initial-enrollment>
      <graduation-date>05-01-1988</graduation-date>
    </academic-info>
  </student>

</student-log>
